{
  "id": "kumocloud-v3-secrets-removed",
  "api_host": "app-prod.kumocloud.com",
  "change": {
    "kind": "field_removed",
    "summary": "The per-device local-control secrets password and cryptoSerial stopped being returned in every response that previously carried them, at any depth. In the same window tempSource and activeThermistor changed from a string to null. Login and send-command were unaffected, so it looked like a client bug rather than an outage.",
    "method": "GET",
    "path_template": "/v3/sites/{id}/zones"
  },
  "announced_at": null,
  "effective_at": "2026-08-01",
  "signals": {
    "spec": { "available": false },
    "changelog": {
      "available": false,
      "note": "An undocumented vendor mobile-app backend: no public portal, no changelog, nothing to watch. A user escalated to the manufacturer and got a phone-support deflection two weeks later."
    },
    "headers": { "available": false },
    "contract": {
      "available": true,
      "detected_at": "2026-08-01",
      "note": "A scheduled call plus a key-set diff flags it on the first poll — the response literally lost named keys. Account-gated: it needs a real account and a provisioned device."
    }
  },
  "evidence_of_pain": [
    "https://github.com/dlarrick/pykumo/issues/78",
    "https://github.com/dlarrick/hass-kumo/issues/230",
    "https://github.com/dlarrick/hass-kumo/issues/233"
  ],
  "confidence": "partial",
  "notes": "effective_at is a bound, not a point: an independent developer records working on 2026-07-28 and broken by 2026-08-01T03:03Z. Reporters did unusually good elimination work — replaying login across six X-App-Version values ruled out an app-version gate, and the legacy v2 endpoint still returned both secrets, proving a deliberate v3 server-side change rather than an outage. Still open six weeks after discovery."
}
